ID,name,instructions,preperationTime,servings,source,course_ID
c686db97-3611-4b10-b79e-ac2f13fa7bb1,Chocolate Chip Cookies,Put the Sugar Eggs and Milk in a Bowl and mix,190,15,Mums Cookbook,a1dd9db6-6e91-4271-9c62-e90581433c1e
3acd0700-23ec-4f08-90f3-9fc303c54dff,Brownies,Put the Chocolate and the Flour in a Bowl and mix,120,20,Brownies.com,3a07d3eb-a5eb-40a5-a10a-a5aa936c95f3
419c15f6-f920-452f-960f-bb06735ec692,Bread,Put the Flour and Water in a Bowl and mix,60,1,Grandmas Cookbook,9f834d6c-5f8f-41a9-9dee-fe6c2421f406
dce03c09-411a-454b-97e8-9de01bbd0225,Grilled Chicken Sandwich,Grill chicken breast and assemble sandwich with lettuce and tomato,20,1,Homemade,3a07d3eb-a5eb-40a5-a10a-a5aa936c95f3
d20f6de3-34c3-4a7c-9e82-327b8ff6ba18,Avocado Pasta,Cook pasta then mix with avocado sauce and serve warm,15,2,Family Recipe,3a07d3eb-a5eb-40a5-a10a-a5aa936c95f3
5390fbea-6abf-40e1-9a89-de59d069b89f,Pancakes,Mix batter then pour on hot pan and flip when bubbles form.,10,3,Grandma,9f834d6c-5f8f-41a9-9dee-fe6c2421f406
118bccca-6daa-4cea-b370-c4c06ebbd691,Greek Yogurt Parfait,Layer yogurt with fruit and granola,5,1,Magazine,9f834d6c-5f8f-41a9-9dee-fe6c2421f406